<?xml version="1.0" encoding="UTF-8" ?>
<menu xmlns="http://www.example.org/menu" xmlns:xsi="http://www.w3.org/2001/XMLSchema-instance"
      xsi:schemaLocation="http://www.example.org/menu menu.xsd">
    <course id="appetizer">
        <dish id="A1">
            <name>Брынза</name>
            <description>Рассольный сыр</description>
            <weight>75</weight>
            <price>10</price>
        </dish>
    </course>
    <course id="main">
        <dish id="B1">
            <name>Жульен</name>
            <description>С курицей</description>
            <weight>120</weight>
            <price>145</price>
        </dish>
    </course>
    <course id="breakfast">
        <dish id="C1">
            <name>Омлет</name>
            <description>2 яйца</description>
            <weight>100</weight>
            <price>56</price>
        </dish>
    </course>
</menu>